src_en	tgt_fr	src_en_ctx	tgt_fr_ctx	src_en_with_tags	orig_fr	orig_fr_with_tags
A long time ago, in a magical, faraway land, several women lived together and, surprise, surprise, they didn't exactly get along.	Il y a longtemps, dans un pays lointain, plusieurs femmes vivaient ensemble et, surprise, surprise, elles ne s'entendaient pas bien.	"So peaceful. Wake up! We got one more! Now, if this don't get you to sleep, nothing will. ""Cinderella"" by nobody remembers.<brk> A long time ago, in a magical, faraway land, several women lived together and, surprise, surprise, they didn't exactly get along."		A long time ago, in a magical, faraway land, several women lived together and, surprise, surprise, <p>they</p> didn't exactly get along.	Il était une fois, dans un monde lointain et magique, quatre  femmes  qui vivaient ensemble, et, surprise, surprise, elles ne s'entendaient pas bien.	Il était une fois, dans un monde lointain et magique, quatre  <hon>femmes<hoff>  qui vivaient ensemble, et, surprise, surprise, <p>elles</p> ne s'entendaient pas bien.
Just when you think your day couldn't get any worse, it got worse.	Juste quand tu penses que ta journée n'a pas pu être pire, elle a empiré.	"Play ball. Come on, Tate. Swing big! Read ""Moneyball,"" asshole. Walks are as good as hits.<brk> Just when you think your day couldn't get any worse, it got worse."		Just when you think your day couldn't get any worse, <p>it</p> got worse.	Quand on se dit que la  journée  ne peut pas aller plus mal, elle empire.	Quand on se dit que la  <hon>journée<hoff>  ne peut pas aller plus mal, <p>elle</p> empire.
These people up here, they've work too hard to see all of their efforts destroyed by one deranged individual.	Ces gens là-haut, ils ont travaillé trop dur pour voir tous leurs efforts détruits par un individu dérangé.	That's my script. Do you have a sec? - Of course, Janet. - Audra. Damn it. You know, I want to be as sensitive as a businessman can be.<brk> These people up here, they've work too hard to see all of their efforts destroyed by one deranged individual.		These people up here, <p>they</p>'ve work too hard to see all of their efforts destroyed by one deranged individual.	Ces  personnes  là, elles travaillent trop dur pour voir tous leurs efforts détruits par une personne dérangée.	Ces  <hon>personnes<hoff>  là, <p>elles</p> travaillent trop dur pour voir tous leurs efforts détruits par une personne dérangée.
I had a sick pig, it died quick.	J'avais un cochon malade, il est mort rapidement.	No, man. Charlie used to sleepwalk. Locked himself in. Hell, he was just eating barbecue yesterday. How could somebody die in a day just from a cold?<brk> I had a sick pig, it died quick.		I had a sick pig, <p>it</p> died quick.	J'avais un  cochon  malade, Il est mort rapidemment.	J'avais un  <hon>cochon<hoff>  malade, <p>Il</p> est mort rapidemment.
I used to put Scotch Tape around my dolls so I'd know if they moved when I was sleeping.	J'avais l'habitude de mettre du whisky dans mes poupées pour savoir si elles bougeaient quand je dormais.	Yes! No. Wait, no, yes, no, yes, no, no, yes, no. You know, when I was a kid, I used to think that there were people in the radio. Like, these little itty-bitty people that climbed in and played on their mini instruments and sang into their tiny microphones! That's stupid.<brk> I used to put Scotch Tape around my dolls so I'd know if they moved when I was sleeping.		I used to put Scotch Tape around my dolls so I'd know if <p>they</p> moved when I was sleeping.	Je mettais du ruban adhésif sur mes  poupées  pour voir si elles bougeaient pendant mon sommeil.	Je mettais du ruban adhésif sur mes  <hon>poupées<hoff>  pour voir si <p>elles</p> bougeaient pendant mon sommeil.
Hold on to this knife and it will become a part of you and your time.	Tiens bon à ce couteau et il deviendra une partie de toi et de ton temps.	Listen to me my mother. The families and masons who formerly lived in this house appeared in the future. They now live in a time where they don't belong. It is enough Leopoldo. You must listen to me!<brk> Hold on to this knife and it will become a part of you and your time.		Hold on to this knife and <p>it</p> will become a part of you and your time.	Prends ce  couteau  et il fera partie de toi et de ton temps.	Prends ce  <hon>couteau<hoff>  et <p>il</p> fera partie de toi et de ton temps.
No way a guy like Sloan wouldn't wash his sheets, so they're fresh.	Pas question qu'un gars comme Sloan ne lave pas ses draps, alors ils sont frais.	Just like the slug we took out of the wall. That's not all I found: fingerprints on the windowsill. Killer saw quite a show. I found semen stains.<brk> No way a guy like Sloan wouldn't wash his sheets, so they're fresh.		No way a guy like Sloan wouldn't wash his sheets, so <p>they</p>'re fresh.	Aucune chance qu'un gars comme Sloan ne lave pas ses  draps , donc elles sont fraîches.	Aucune chance qu'un gars comme Sloan ne lave pas ses  <hon>draps<hoff> , donc <p>elles</p> sont fraîches.
The skin is dry, it's inelastic.	La peau est sèche, elle est inélastique.	It's negative, Jim. No visible signs of trauma. No bloating. Tongue and soft palate appear pale, almost white. Eyes are clear.<brk> The skin is dry, it's inelastic.		The skin is dry, <p>it</p>'s inelastic.	La  peau  est sèche, elle a perdue son élasticité.	La  <hon>peau<hoff>  est sèche, <p>elle</p> a perdue son élasticité.
Um, both women decided they could do better.	Les deux femmes ont décidé qu'elles pourraient faire mieux.	I'll make him eat his broccoli uh, brush his teeth, in bed at 8:00... [ Chuckles ] No, in bed by 7:00. - 7:00, of course. Eric: - Mom! Look! Oh, what happened?<brk> Um, both women decided they could do better.		Um, both women decided <p>they</p> could do better.	Les deux  femmes  ont décidé qu'elles pouvaient avoir mieux.	Les deux  <hon>femmes<hoff>  ont décidé qu'<p>elles</p> pouvaient avoir mieux.
Meatball's lyrics may seem simple at first, but like an onion, they're many-layered underneath.	Les paroles de Meatball peuvent sembler simples au début, mais comme un oignon, elles sont faites de plusieurs couches.	Look. This tracks Lemon's location by her cell phone signal. Those fe this up when I got lost bringing her iced teduring that Civil War reenactment. accidently run into her. Those fe this up when I got lost And make her see just exactly what she's been missing.<brk> Meatball's lyrics may seem simple at first, but like an onion, they're many-layered underneath.		Meatball's lyrics may seem simple at first, but like an onion, <p>they</p>'re many-layered underneath.	Les  paroles  de Meatball semblent simples au premier abord, mais c'est comme un oignon, elles ont beaucoup de sous couches.	Les  <hon>paroles<hoff>  de Meatball semblent simples au premier abord, mais c'est comme un oignon, <p>elles</p> ont beaucoup de sous couches.
Well, I had a house, and it was very clean.	Eh bien, j'avais une maison, et elle était très propre.	"That was like a game of ""rock, paper, pervert."" Sophie, thank you for coming in. Max and I wanted to talk to you about taking you up on your offer to work for your cleaning company. Yeah, she wants to do it for money to pay for our website, and I want to do it because I like rummaging through strangers' medicine cabinets. Have you cleaned houses before?<brk> Well, I had a house, and it was very clean."		Well, I had a house, and <p>it</p> was very clean.	Eh bien, j'avais une  maison  et elle était très propre.	Eh bien, j'avais une  <hon>maison<hoff>  et <p>elle</p> était très propre.
These things are never how they look.	Ces choses ne sont jamais à quoi elles ressemblent.	He probably spends that on hair gel. DANVILLE: I don't know. Feels more like strategy to me than charity. You think? (crowd chatter, Kemp laughs)<brk> These things are never how they look.		These things are never how <p>they</p> look.	Ces  choses  la ne sont jamais comme elles semblent.	Ces  <hon>choses<hoff>  la ne sont jamais comme <p>elles</p> semblent.
- Vee, I want you to talk to the girls at the hospital, see what they can tell us.	- Vee, je veux que tu parles aux filles de l'hôpital, pour voir ce qu'elles peuvent nous dire.	I mean, if you're selling the skins, then why damage the merchandise? Must have been a beggun, a runner. Make an example out of them by sawing off their legs in front of the other girls. If those dates are right, they shipped 30 girls a week ago. - There were only ten here.<brk> - Vee, I want you to talk to the girls at the hospital, see what they can tell us.		- Vee, I want you to talk to the girls at the hospital, see what <p>they</p> can tell us.	- Vee, je veux que tu parles aux autres  filles  à l'hôpital, vois ce qu'elles peuvent nous apprendre.	- Vee, je veux que tu parles aux autres  <hon>filles<hoff>  à l'hôpital, vois ce qu'<p>elles</p> peuvent nous apprendre.
She had access to the 50th floor of the Empire State Building while it was under renovation.	Elle avait accès au 50ème étage de l'Empire State Building pendant qu'il était en travaux.	I'm sorry, but you got to go back. Listen, you've been looking for that evidence box for, what, three months now? I've been after it for 30 years. Now you say you're close. When WITSEC moved Ellen to New York 12 years ago, they gave her a job at a securities firm.<brk> She had access to the 50th floor of the Empire State Building while it was under renovation.		She had access to the 50th floor of the Empire State Building while <p>it</p> was under renovation.	Elle avait accès au 50e étage de l' Empire State Bulding  quand il était en rénovation.	Elle avait accès au 50e étage de l' <hon>Empire State Bulding<hoff>  quand <p>il</p> était en rénovation.
By the time the D.A. voids my case, all those ladies you have lunch with, your friends on the board of the Central Park zoo... they'll know all about it.	Au moment où le procureur annulera mon dossier, toutes ces femmes avec qui tu déjeunes, tes amies du conseil d'administration du zoo de Central Park, elles sauront tout.	- Yes, you could! You chose to do nothing! I stood by and watched on the sidelines once too, and I still think about it, but this was your daughter. You can't arrest me. Oh, I can arrest you.<brk> By the time the D.A. voids my case, all those ladies you have lunch with, your friends on the board of the Central Park zoo... they'll know all about it.		By the time the D.A. voids my case, all those ladies you have lunch with, your friends on the board of the Central Park zoo... <p>they</p>'ll know all about it.	D'ici à ce que le procureur annule mon dossier, toutes ces  femmes  avec qui vous déjeunez, vos amies du bureau du Zoo de Central Park... elles sauront tout.	D'ici à ce que le procureur annule mon dossier, toutes ces  <hon>femmes<hoff>  avec qui vous déjeunez, vos amies du bureau du Zoo de Central Park... <p>elles</p> sauront tout.
The virus may not effect Fae, but I have to treat the affected humans before the substance mutates ... which very well could happen if it keeps jumping the species barrier.	Le virus n'aura peut-être pas d'effet sur Fae, mais je dois soigner les humains affectés avant que la substance ne mute... ce qui pourrait très bien arriver si elle continue de sauter la barrière des espèces.	Let's go... So, what gives? I give. I mean, I will... give. I brought the antidote.<brk> The virus may not effect Fae, but I have to treat the affected humans before the substance mutates ... which very well could happen if it keeps jumping the species barrier.		The virus may not effect Fae, but I have to treat the affected humans before the substance mutates ... which very well could happen if <p>it</p> keeps jumping the species barrier.	Le  virus  n'affectera peut-être pas les fae, mais j'ai pour traiter les êtres humains touchés avant que la substance change ... ce qui pourrait bien arriver s'il continue à sauter la barrière inter-espèces	Le  <hon>virus<hoff>  n'affectera peut-être pas les fae, mais j'ai pour traiter les êtres humains touchés avant que la substance change ... ce qui pourrait bien arriver s'<p>il</p> continue à sauter la barrière inter-espèces
If this storm is as bad as we think it is, - we're never going to survive.	Si cette tempête est aussi mauvaise qu'on le croit, on ne survivra jamais.	And that's what we'll have to do with these sheep. We gotta prove to them they have nothing to fear... Oh, at this rate, we'll never get any milk or eggs. Just as I feared. We haven't had time to fully stock the food storehouse.<brk> If this storm is as bad as we think it is, - we're never going to survive.		If this storm is as bad as we think <p>it</p> is, - we're never going to survive.	Si cette  tempête  est aussi mauvaise que nous pensons qu'elle l'est, nous n'allons jamais survivre.	Si cette  <hon>tempête<hoff>  est aussi mauvaise que nous pensons qu'<p>elle</p> l'est, nous n'allons jamais survivre.
I gave my opinion this afternoon; it hasn't changed.	J'ai donné mon avis cet après-midi, il n'a pas changé.	His... He was told to go professional, he didn't listen. Who didn't listen? Your barber? Ha. Let's go.<brk> I gave my opinion this afternoon; it hasn't changed.		I gave my opinion this afternoon; <p>it</p> hasn't changed.	J'ai déjà donné mon  opinion  cet après-midi ; elle n'a pas changé.	J'ai déjà donné mon  <hon>opinion<hoff>  cet après-midi ; <p>elle</p> n'a pas changé.
Did you know that if a cat's mum has a deformed baby, it will just eat that baby?	Saviez-vous que si la maman d'un chat a un bébé déformé, elle le mangera?	That's a good life lesson, yeah. Everyone's disgusting. I'll get you a towel. Such a gentleman. It's a bit damp but it's OK.<brk> Did you know that if a cat's mum has a deformed baby, it will just eat that baby?		Did you know that if a cat's mum has a deformed baby, <p>it</p> will just eat that baby?	Tu savais que si une  maman  chat a un bébé mal-formé, elle mange le bébé ?	Tu savais que si une  <hon>maman<hoff>  chat a un bébé mal-formé, <p>elle</p> mange le bébé ?
Don't sleep with all those girls, 'cause then they come at me.	Ne couchez pas avec toutes ces filles, parce qu'elles m'attaquent.	<brk> Don't sleep with all those girls, 'cause then they come at me.		Don't sleep with all those girls, 'cause then <p>they</p> come at me.	Ne couche pas avec toutes ces  filles  parce qu'après elles viennent me voir.	Ne couche pas avec toutes ces  <hon>filles<hoff>  parce qu'après <p>elles</p> viennent me voir.
Your drink is only about half as full as it should be, Frank.	Votre verre n'est que la moitié de ce qu'il devrait être, Frank.	South Carolina's premiere military college. They taught me the values of honor, duty, and respect. They also hazed me, tried to break me, and, senior year, nearly expelled me when I volunteered for a Senate Race and my studies suffered. But that didn't stop them from soliciting a hefty sum for their new library 30 years later. How quickly poor grades are forgotten in the shadow of power and wealth.<brk> Your drink is only about half as full as it should be, Frank.		Your drink is only about half as full as <p>it</p> should be, Frank.	Ton  verre  n'est pas aussi plein qu'il devrait l'être, Frank.	Ton  <hon>verre<hoff>  n'est pas aussi plein qu'<p>il</p> devrait l'être, Frank.
We've recreated this settlement exactly as it was 100 years earlier.	Nous avons recréé cette colonie exactement comme elle était 100 ans auparavant.	In this experiment, you'll be allowed to govern yourselves completely with no interference and no help. We will abandon you with a camera crew to document your adventure, but the world you know is gone-- slate wiped clean, and you will start a new civilization. - Are you ready to begin? - Yes. Okay. 2 miles due east... are the remains of a primitive settlement, an outpost where fur traders would stop to barter their wares. But one day in 1908, this settlement was found abandoned, fire still burning, food still cooking in pots, but its 14 inhabitants had mysteriously disappeared, never to be seen again.<brk> We've recreated this settlement exactly as it was 100 years earlier.		We've recreated this settlement exactly as <p>it</p> was 100 years earlier.	On a reconstitué cette  colonie  comme elle était un siècle plus tôt.	On a reconstitué cette  <hon>colonie<hoff>  comme <p>elle</p> était un siècle plus tôt.
She was caught hiding in a cargo hold of a freighter before it set sail down the Mississippi.	Elle a été attrapée dans la soute d'un cargo avant qu'il ne redescende le Mississippi.	Katie doesn't deserve to die. You're in no position to be so principled. You can't win a war without a few strategic losses, no matter how regrettable they may be. How many times have the vampires been one step ahead, known something they shouldn't, your sister executed in the public square for practicing magic who knew she'd be caught? Did she even attempt to flee?<brk> She was caught hiding in a cargo hold of a freighter before it set sail down the Mississippi.		She was caught hiding in a cargo hold of a freighter before <p>it</p> set sail down the Mississippi.	Elle s'était cachée à bord d'un  bateau  avant qu'il descende le Mississippi.	Elle s'était cachée à bord d'un  <hon>bateau<hoff>  avant qu'<p>il</p> descende le Mississippi.
So I do the history, even though it may hurt people.	Je fais donc l' histoire, même si elle peut faire du mal aux gens.	I can't find anything. There's a problem here. You're delving into the origins of Muslims' deepest beliefs but where is the historical evidence? Sometimes the belief of the believer, and the understanding of the scholar, cannot be squared. It's a choice between doing history and not doing history.<brk> So I do the history, even though it may hurt people.		So I do the history, even though <p>it</p> may hurt people.	Donc, je fais l' histoire , même si elle peut blesser les gens.	Donc, je fais l' <hon>histoire<hoff> , même si <p>elle</p> peut blesser les gens.
The town is gonna need an explanation, one that answers more questions than it raises, one that protects the ones who are still here.	La ville aura besoin d'explications, une qui réponde plus aux questions qu'elle n'en soulève, une qui protège ceux qui sont encore là.	- to the in-- - Dad. He's OK. He's OK. Your aunt and I have spoken.<brk> The town is gonna need an explanation, one that answers more questions than it raises, one that protects the ones who are still here.		The town is gonna need an explanation, one that answers more questions than <p>it</p> raises, one that protects the ones who are still here.	La ville aura besoin d'une  explication , qui réponde à plus de questions qu'elle n'en soulève, et qui protège ceux qui sont toujours là.	La ville aura besoin d'une  <hon>explication<hoff> , qui réponde à plus de questions qu'<p>elle</p> n'en soulève, et qui protège ceux qui sont toujours là.
Show these witches no fear or they will devour you.	Montrer à ces sorcières qu'elles n'ont pas peur, sinon elles vous dévoreront.	Don't you know men who come here never leave? I am here to speak with the warrior who is said to live here. I am a chief. Is that right? A chief?<brk> Show these witches no fear or they will devour you.		Show these witches no fear or <p>they</p> will devour you.	Ne montre pas ta peur à ces  sorcières  ou elles te dévoreront.	Ne montre pas ta peur à ces  <hon>sorcières<hoff>  ou <p>elles</p> te dévoreront.
Lord of lords, we make this offering to you, hoping you will find it pleasing.	Seigneur des seigneurs, nous te faisons cette offrande, en espérant que tu la trouveras agréable.	He is so weak he cannot eat. Pray to the gods, please, for him. Wait, no. I said no. No.<brk> Lord of lords, we make this offering to you, hoping you will find it pleasing.		Lord of lords, we make this offering to you, hoping you will find <p>it</p> pleasing.	Seigneur d'entre les seigneurs, nous te faisons cette  offrande  en espérant qu'elle te satisfasse.	Seigneur d'entre les seigneurs, nous te faisons cette  <hon>offrande<hoff>  en espérant qu'<p>elle</p> te satisfasse.
Steel-toed boots may be the punk style, but they definitely clashed with his skull.	Les bottes à pointes d'acier sont peut-être du style punk, mais elles se sont heurtées à son crâne.	Yeah, if it wasn't for that cash, uh... club would've been closed tonight. Sorry to keep you waiting. And without a stack of old National Geographics, like a proper doctor. David's still prepping the last victim, but here's what we have so far. Kevin Ellis. C.O.D.'s intracerebral hemorrhage due to multiple blunt force trauma.<brk> Steel-toed boots may be the punk style, but they definitely clashed with his skull.		Steel-toed boots may be the punk style, but <p>they</p> definitely clashed with his skull.	Des  bottes  à embout d'acier peut être du style punk, mais elles ont vraiment heurté son crâne.	Des  <hon>bottes<hoff>  à embout d'acier peut être du style punk, mais <p>elles</p> ont vraiment heurté son crâne.
Only the road knows, where it will end.	Seule la route sait où elle s'arrêtera.	Life makes you pay dearly, lt's such a raw deal It's a long, bumpy truck ride, And there's never a free meal Even these breaths we borrow will escape us tomorrow. We seek a home, around every bend,<brk> Only the road knows, where it will end.		Only the road knows, where <p>it</p> will end.	Seule la  route  sait où elle se terminera.	Seule la  <hon>route<hoff>  sait où <p>elle</p> se terminera.
The women come out worse than they went in.	Les femmes sortent moins bien qu'elles n'entraient.	Yeah. She's being looked after. You've seen her, have you? I just want to know if she's all right. The wet cells aren't built for comfort, Doreen. Oh, Miss Davidson, I'm sorry.<brk> The women come out worse than they went in.		The women come out worse than <p>they</p> went in.	Les  femmes  en sortent pires que quand elles y rentrent.	Les  <hon>femmes<hoff>  en sortent pires que quand <p>elles</p> y rentrent.
For the chip to process data organically, it had to be connected to the hippocampus.	Pour traiter les données de façon organique, il a fallu qu'il soit connecté à l'hippocampe.	You need to do something. I'm trying to do something, Riley. The brain works much like a computer, okay, even without the chip. There's short-term memory... ram, if you will... and there is long-term memory, a hard drive known as the hippocampus.<brk> For the chip to process data organically, it had to be connected to the hippocampus.		For the chip to process data organically, <p>it</p> had to be connected to the hippocampus.	Pour que la  puce  traite les données organiques, elle doit être connectée à l'hippocampe.	Pour que la  <hon>puce<hoff>  traite les données organiques, <p>elle</p> doit être connectée à l'hippocampe.
Things would go back to the way they were.	Les choses allaient redevenir ce qu'elles étaient.	- ( Chuckles ) - I did! I mean, you know, more than normal. Look, I... The book took a lot of time and commitment from you, from me, from the kids, and I'm very proud of what you did. But I thought that when the book was done...<brk> Things would go back to the way they were.		Things would go back to the way <p>they</p> were.	Les  choses  reprendraient là où elles étaient.	Les  <hon>choses<hoff>  reprendraient là où <p>elles</p> étaient.
I just told my girlfriends it was you guys, and they didn't believe me.	J'ai dit à mes copines que c'était vous et elles ne m'ont pas cru.	T.K., I actually brought you here to talk to you. How do I say this? Oh, my God! Rex Evans and Terrence King. [ Laughs ]<brk> I just told my girlfriends it was you guys, and they didn't believe me.		I just told my girlfriends it was you guys, and <p>they</p> didn't believe me.	J'ai dit à mes  copines  que c'était bien vous, et elles ont pas voulu me croire.	J'ai dit à mes  <hon>copines<hoff>  que c'était bien vous, et <p>elles</p> ont pas voulu me croire.
The winning argument is like a fine wine - it gives me a feeling of wellbeing.	L'argument gagnant est comme un bon vin - il me donne un sentiment de bien-être.	However, were the occasion an anniversary, then I must direct you to our most glittering gift. Though expensive, our engraved silver purses would make any birthday an occasion to treasure. Now... Shall we leave you a moment or two to muse, or are you ready to decide? None of us expected this to happen, but perhaps we should all admit it's for the best, hmm? I cherish reason.<brk> The winning argument is like a fine wine - it gives me a feeling of wellbeing.		The winning argument is like a fine wine - <p>it</p> gives me a feeling of wellbeing.	L' argument  gagnant est comme un bon vin, il me donne une sensation de bien-être.	L' <hon>argument<hoff>  gagnant est comme un bon vin, <p>il</p> me donne une sensation de bien-être.
