src_en	tgt_fr	src_en_ctx	tgt_fr_ctx	src_en_with_tags	orig_fr	orig_fr_with_tags
The two girls, aged 6 and 7, are believed to have been... playing on this street when they disappeared without a trace.	On raconte que les deux filles de 6 et 7 ans jouaient dans cette rue quand elles ont disparu sans laisser de trace.	Tell me. Tell me! Tell me! Tell me! Tell me! Where's my daughter? Four days have passed since Anna Dover and Joy Birch... were last seen by their families.<brk> The two girls, aged 6 and 7, are believed to have been... playing on this street when they disappeared without a trace.		The two girls, aged 6 and 7, are believed to have been... playing on this street when <p>they</p> disappeared without a trace.	Les deux petites  filles , âgées de 6 et 7 ans, jouaient vraisemblablement dans cette rue quand elles ont disparu sans laisser de trace.	Les deux petites  <hon>filles<hoff> , âgées de 6 et 7 ans, jouaient vraisemblablement dans cette rue quand <p>elles</p> ont disparu sans laisser de trace.
Financial firms like to co-locate with internet hubs so they can get their trades in a few picoseconds faster.	Les sociétés financières aiment co-localiser avec les centres internet pour qu'elles puissent faire leurs affaires plus vite en quelques picosecondes.	Any luck getting more info on him? It's gonna take more than luck. The firm's firewall is even better than Peck's. Yeah, I've got line of sight on his office, but I can't get any signals from his wi-fi or his cell. He works in the IQZ telecom building.<brk> Financial firms like to co-locate with internet hubs so they can get their trades in a few picoseconds faster.		Financial firms like to co-locate with internet hubs so <p>they</p> can get their trades in a few picoseconds faster.	Les  firmes  financières aiment être près d'un pôle internet ainsi elles peuvent effectuer des échanges en quelques pico-secondes plus vite.	Les  <hon>firmes<hoff>  financières aiment être près d'un pôle internet ainsi <p>elles</p> peuvent effectuer des échanges en quelques pico-secondes plus vite.
Always keep the cord around your wrist... then it won't slip when you come down hard.	Gardez toujours le fil autour de votre poignet... alors il ne glissera pas quand vous redescendez fort.	Now, come at me. Right here. As hard as you can. Their legs go like runny shit! Then here, see?<brk> Always keep the cord around your wrist... then it won't slip when you come down hard.		Always keep the cord around your wrist... then <p>it</p> won't slip when you come down hard.	Garde toujours la  corde  autour de ton poignet, comme ça elle ne glissera pas quand tu attaqueras fort.	Garde toujours la  <hon>corde<hoff>  autour de ton poignet, comme ça <p>elle</p> ne glissera pas quand tu attaqueras fort.
Annie, my life didn't end when I stopped walking, and I'm sorry, but it didn't start again the minute I met you.	Annie, ma vie ne s'est pas arrêtée quand j'ai arrêté de marcher, et je suis désolé, mais elle n'a pas recommencé dès que je t'ai vue.	I know we just started dating, but the truth is, if this actually goes somewhere, I'm not sure what I'm supposed to do or how this is supposed to work. Okay. Why don't you start by telling me what you'd do to a guy who stood you up? That's more like it. What are you doing?<brk> Annie, my life didn't end when I stopped walking, and I'm sorry, but it didn't start again the minute I met you.		Annie, my life didn't end when I stopped walking, and I'm sorry, but <p>it</p> didn't start again the minute I met you.	Annie, ma  vie  ne s'est pas arrêtée quand j'ai cessé de marcher. Et je suis désolé mais elle n'a pas recommencé à la minute où je t'ai rencontrée.	Annie, ma  <hon>vie<hoff>  ne s'est pas arrêtée quand j'ai cessé de marcher. Et je suis désolé mais <p>elle</p> n'a pas recommencé à la minute où je t'ai rencontrée.
Well, your weight gain is right where it should be for the third trimester.	Eh bien, ta prise de poids est là où elle devrait être pour le troisième trimestre.	You know what, Pam? Why don't I check out Mel, and if we do need you, we'll come get you? How are you feeling? Tired. Huge.<brk> Well, your weight gain is right where it should be for the third trimester.		Well, your weight gain is right where <p>it</p> should be for the third trimester.	Ta  prise  de poids est exactement ce qu'elle dois être au 3e trimestre.	Ta  <hon>prise<hoff>  de poids est exactement ce qu'<p>elle</p> dois être au 3e trimestre.
I saw their life together, and it is happy.	J'ai vu leur vie ensemble, et elle est heureuse.	The blood that has been spilled, my blood yet, was because of what you foresaw. It's not a science, it's a gift. Sometimes I hear voices, other times it's a feeling, a certainty as solid as stone. And this new feeling? It came to me today.<brk> I saw their life together, and it is happy.		I saw their life together, and <p>it</p> is happy.	J'ai vu leur  vie  ensemble, et elle était joyeuse.	J'ai vu leur  <hon>vie<hoff>  ensemble, et <p>elle</p> était joyeuse.
But this surgery, it has the potential to be more than just a treatment.	Mais cette opération, elle a le potentiel d'être plus qu'un simple traitement.	But one thing I can promise is that this gives you a little hope. Isn't that what you said about chemo? What we said about chemo was that it would buy you some time. Right. And what you told us was that you didn't want whatever time you had left ruined by what chemo does to your body.<brk> But this surgery, it has the potential to be more than just a treatment.		But this surgery, <p>it</p> has the potential to be more than just a treatment.	Mais cette  opération , elle a la possibilité d'être plus qu'un traitement.	Mais cette  <hon>opération<hoff> , <p>elle</p> a la possibilité d'être plus qu'un traitement.
When stormy solar winds blow, this zone of protection grows; in calm solar weather, it shrinks.	Quand les vents solaires tempétueux soufflent, cette zone de protection grandit, et par un temps calme, elle rétrécit.	There's a border where one ends and the other begins. Voyager 1 reported back to Earth that its detectors were being pummeled by more and more cosmic rays. Until then, we didn't know where the interstellar ocean began. Voyager 1 pressed on past a boundary we had never crossed before. The heliosphere shields us from most of the deadly cosmic rays.<brk> When stormy solar winds blow, this zone of protection grows; in calm solar weather, it shrinks.		When stormy solar winds blow, this zone of protection grows; in calm solar weather, <p>it</p> shrinks.	Quand un vent solaire orageux souffle, cette  zone  de protection grandit, par temps solaire calme, elle rétrécit.	Quand un vent solaire orageux souffle, cette  <hon>zone<hoff>  de protection grandit, par temps solaire calme, <p>elle</p> rétrécit.
Do you know some churches have removed Their fonts of holy water because they fear It's a source of bacterial and viral infection?	Savez-vous que certaines églises ont retiré leurs polices d'eau sacrée parce qu'elles craignent qu'elle soit une source d'infection bactérienne et virale?	Come on. We have to call the cavalry. The woman. Lynch. Where is she?<brk> Do you know some churches have removed Their fonts of holy water because they fear It's a source of bacterial and viral infection?		Do you know some churches have removed Their fonts of holy water because <p>they</p> fear It's a source of bacterial and viral infection?	Sais-tu que certaines églises ont retiré leurs  fontaines  d'eau bénie parce qu'ils craigaient qu'elles soient une source d'infection bactérienne ou virale ?	Sais-tu que certaines églises ont retiré leurs  <hon>fontaines<hoff>  d'eau bénie parce qu'ils craigaient qu'<p>elles</p> soient une source d'infection bactérienne ou virale ?
He goes to bars, hosting events, holding girls' hair back while they puke into their purses.	Il va dans des bars, à organiser des événements, à tenir les cheveux des filles pendant qu'elles vomissent dans leur sac.	Uh, a Tequila brand amb... ambassador thing? What the hell's that? Something dumb. Okay... He's the face of the brand.<brk> He goes to bars, hosting events, holding girls' hair back while they puke into their purses.		He goes to bars, hosting events, holding girls' hair back while <p>they</p> puke into their purses.	Il va dans les bars, reçoit aux soirées, tient les cheveux des  filles  pendant qu'elles vomissent dans leurs sacs.	Il va dans les bars, reçoit aux soirées, tient les cheveux des  <hon>filles<hoff>  pendant qu'<p>elles</p> vomissent dans leurs sacs.
Ms. Walker, those questions are inappropriate, and they are not helpful.	Mme Walker, ces questions sont inappropriées, et elles ne sont pas utiles.	That's before we were involved. Really? Well, forgive us for feeling that you have not upheld your side of the bargain. Is there anything that Mossad could share with us about the intel on that watch? Maybe if we had some specific leads--<brk> Ms. Walker, those questions are inappropriate, and they are not helpful.		Ms. Walker, those questions are inappropriate, and <p>they</p> are not helpful.	Mme Walker, ces  questions  ne sont pas appropriées, et elles ne sont pas utiles.	Mme Walker, ces  <hon>questions<hoff>  ne sont pas appropriées, et <p>elles</p> ne sont pas utiles.
"Sweet baby Jesus put that ring on Holly's finger before it winds up on Violet's."""	"doux bébé Jésus a mis cette bague sur le doigt de Holly avant qu'elle ne finisse sur celui de Violet."""	"Yeah, I don't really feel like thinking about me anymore. Go on. - What? - Well, okay, then. It was like earlier tonight, when we were digging in trying to find Gran's ring to give it to Andy Violet was like, ""I don't need a ring to prove to the world that you are mine."" All I kept thinking was, ""Jesus, please.<brk> Sweet baby Jesus put that ring on Holly's finger before it winds up on Violet's."""		"Sweet baby Jesus put that ring on Holly's finger before <p>it</p> winds up on Violet's."""	"Doux Jesus, met cette  bague  au doigt de Holly avant qu'elle ne finisse sur celui de violette ""."	"Doux Jesus, met cette  <hon>bague<hoff>  au doigt de Holly avant qu'<p>elle</p> ne finisse sur celui de violette ""."
And two, if you're going to wear a skirt, it has to cover at least some of your thigh.	Et deuxièmement, si vous devez porter une jupe, elle doit couvrir au moins une partie de votre cuisse.	I mean, familiar with the products. Damn it. I've got to stop using the no-no words. Lacey, we have two rules here. One, if you're going to be late, you have to call.<brk> And two, if you're going to wear a skirt, it has to cover at least some of your thigh.		And two, if you're going to wear a skirt, <p>it</p> has to cover at least some of your thigh.	et la deuxième, si tu dois porter une  jupe , elle doit couvrir un peu tes cuisses.	et la deuxième, si tu dois porter une  <hon>jupe<hoff> , <p>elle</p> doit couvrir un peu tes cuisses.
If this is where those things get made, Maybe they can get unmade.	Si c'est là que ces choses sont faites, peut-être qu'elles peuvent être défaites.	And then, after that, It's one stake through his heart. Did you hear me, seth? I'm in. There's all kinds of markings on these walls.<brk> If this is where those things get made, Maybe they can get unmade.		If this is where those things get made, Maybe <p>they</p> can get unmade.	Si c'est là que ces  choses  sont fabriquées peut être qu'elles peuvent être défabriquées.	Si c'est là que ces  <hon>choses<hoff>  sont fabriquées peut être qu'<p>elles</p> peuvent être défabriquées.
Ok, I got this Australian wool and it is on sale,	OK, j'ai cette laine australienne et elle est en solde,	Hale! I just need two seconds of your time. Oh! Sick outfit. Very Gaga-esque.<brk> Ok, I got this Australian wool and it is on sale,		Ok, I got this Australian wool and <p>it</p> is on sale,	Ok, j'ai eu cette  laine  australienne et elle est en soldes.	Ok, j'ai eu cette  <hon>laine<hoff>  australienne et <p>elle</p> est en soldes.
And other victims like to know they're not alone.	Et d'autres victimes aiment savoir qu'elles ne sont pas seules.	Uh, this is my private number. - I-I really don't-- - I know. I know this is a difficult time, and I'm sorry to bother you, but have you thought about sharing your story? No. Because people draw strength from reading about survivors like you.<brk> And other victims like to know they're not alone.		And other victims like to know <p>they</p>'re not alone.	Et d'autres  victimes  aimeraient savoir qu'elles ne sont pas seules.	Et d'autres  <hon>victimes<hoff>  aimeraient savoir qu'<p>elles</p> ne sont pas seules.
But women, they look different, fight different, smell different.	Mais les femmes, elles ont l'air différentes, se battent différemment, sentent différemment.	Something I can do? You ever fight a woman? Depends. Business or pleasure? Look, they do say crazy makes you strong.<brk> But women, they look different, fight different, smell different.		But women, <p>they</p> look different, fight different, smell different.	Mais les  femmes , elles sont différentes, se battent différemment, sentent différemment.	Mais les  <hon>femmes<hoff> , <p>elles</p> sont différentes, se battent différemment, sentent différemment.
The, uh, Safety Patrol girls, they told me the eye wash was broken, so I came rushing.	Les filles de la patrouille de sécurité, elles m'ont dit que la lavante était cassée, alors j'ai accouru.	- I farted on her pillow. - Nice. Look, you should tell Joel what you told me. Oh, hello. Your, uh, classroom looks beautiful. Yeah. It's not normally like this.<brk> The, uh, Safety Patrol girls, they told me the eye wash was broken, so I came rushing.		The, uh, Safety Patrol girls, <p>they</p> told me the eye wash was broken, so I came rushing.	Les  filles  de la Patrouille de Sécurité, elles m'ont dit que le rince-œil était cassé, je suis venue en urgence.	Les  <hon>filles<hoff>  de la Patrouille de Sécurité, <p>elles</p> m'ont dit que le rince-œil était cassé, je suis venue en urgence.
I've been reusing the hot dog water so it gets more flavor.	J'ai réutilisé l' eau du hot dog pour qu'elle ait plus de goût.	- Performance reviews. How can you give us {\*performance }reviews if you don't know us? On first impressions, so I recommend smiling. It goes a long way with me. Erin, you really nailed the hot dogs today.<brk> I've been reusing the hot dog water so it gets more flavor.		I've been reusing the hot dog water so <p>it</p> gets more flavor.	Merci, je garde l' eau  des saucisses pour qu'elle prenne le goût.	Merci, je garde l' <hon>eau<hoff>  des saucisses pour qu'<p>elle</p> prenne le goût.
Um, that's awesome, but I think I'll visit my ex-girlfriends and prove they still like me.	Euh, c'est génial, mais je pense que je vais rendre visite à mes ex copines et prouver qu'elles m'aiment toujours.	Because then you can express your unfiltered feelings by drunk dialing. Observe. Hey, it's me again. He's there, isn't he? Well, I hope this doesn't sound weird, but I'm inside your closet.<brk> Um, that's awesome, but I think I'll visit my ex-girlfriends and prove they still like me.		Um, that's awesome, but I think I'll visit my ex-girlfriends and prove <p>they</p> still like me.	C'est génial, mais je vais rendre visite à mes ex  copines  et prouver qu'elles m'aiment toujours.	C'est génial, mais je vais rendre visite à mes ex  <hon>copines<hoff>  et prouver qu'<p>elles</p> m'aiment toujours.
I think I'll just take things as they come.	Je pense que je vais prendre les choses comme elles viennent.	I'll keep my eye out. Sheriff, I wouldn't be bothering you if I didn't think you have a serious problem on your hands. I don't deny your abilities. It's just that your hands are tied by this office, whereas I have a talent for resolving problems like this one quietly. I appreciate your concern, but...<brk> I think I'll just take things as they come.		I think I'll just take things as <p>they</p> come.	Je prendrai les  choses  comme elles viendront.	Je prendrai les  <hon>choses<hoff>  comme <p>elles</p> viendront.
They've got a big old wall to hide behind, but it only guards one side.	Ils ont un vieux mur derrière eux, mais il ne garde qu'un côté.	If not... throw him off the Wall. See if crows can fly. We're finally going to war, old friend? Hide near Castle Black. When I give the signal, hit them in the night.<brk> They've got a big old wall to hide behind, but it only guards one side.		They've got a big old wall to hide behind, but <p>it</p> only guards one side.	Ils ont un grand  mur  derrière lequel se cacher, mais il ne garde qu'un côté.	Ils ont un grand  <hon>mur<hoff>  derrière lequel se cacher, mais <p>il</p> ne garde qu'un côté.
There are more meetings, and they're longer, and he keeps talking about some corporate retreat, which I know is just a sweat lodge at Burning Man.	Il y a d'autres réunions, et elles sont plus longues, et il continue de parler de retraites corporatives, dont je sais qu'il est un suight lodge à Burning Man.	I'm gonna go to the restroom, collect my thoughts, and when I come back, we'll continue this conversation. Okay, you do that. Just one? I can do this in one. What's it like being counsel for Taco Corp now that he actually has some money?<brk> There are more meetings, and they're longer, and he keeps talking about some corporate retreat, which I know is just a sweat lodge at Burning Man.		There are more meetings, and <p>they</p>'re longer, and he keeps talking about some corporate retreat, which I know is just a sweat lodge at Burning Man.	Il y a plus de  réunions , elles sont plus longues, et il n'arrête pas de parler de fond de retraite, mais je sais que ce n'est qu'un beau lodge à Burning Man.	Il y a plus de  <hon>réunions<hoff> , <p>elles</p> sont plus longues, et il n'arrête pas de parler de fond de retraite, mais je sais que ce n'est qu'un beau lodge à Burning Man.
I mean, I know she thinks I haven't done enough with my life considering, you know, my age, but it's hard to tell someone so young that things don't always end up the way you thought they'd be.	Je veux dire, je sais qu'elle pense que je n'en ai pas assez fait de ma vie compte tenu de, vous savez, mon âge, mais il est difficile de dire à quelqu'un si jeune que les choses ne finissent pas toujours comme vous pensiez qu'elles seraient.	- ( dog barks ) - Jesus. How's that going with you and Shoshanna? Good. Really good. Really good.<brk> I mean, I know she thinks I haven't done enough with my life considering, you know, my age, but it's hard to tell someone so young that things don't always end up the way you thought they'd be.		I mean, I know she thinks I haven't done enough with my life considering, you know, my age, but it's hard to tell someone so young that things don't always end up the way you thought <p>they</p>'d be.	Je veux dire, je sais qu'elle pense que je n'en ai pas fait assez avec ma vie considérant, tu sais, mon âge, mais c'est difficile de dire à quelqu'un de si jeune que les  choses  ne finissent pas toujours de la façon dont on pensait qu'elles finiraient.	Je veux dire, je sais qu'elle pense que je n'en ai pas fait assez avec ma vie considérant, tu sais, mon âge, mais c'est difficile de dire à quelqu'un de si jeune que les  <hon>choses<hoff>  ne finissent pas toujours de la façon dont on pensait qu'<p>elles</p> finiraient.
The rental is reasonable, that's why it's very popular.	La location est raisonnable, c'est pourquoi elle est très populaire.	Se Ra and I are living together. This time, I'm the owner. So, you're happy? To me, this is bad news. Really.<brk> The rental is reasonable, that's why it's very popular.		The rental is reasonable, that's why <p>it</p>'s very popular.	Le  loyer  est raisonnable, c'est pour cela qu'il est en vogue.	Le  <hon>loyer<hoff>  est raisonnable, c'est pour cela qu'<p>il</p> est en vogue.
She can see the show when it's ready.	Elle voit le spectacle quand il est prêt.	- expensive German sports cars. - Don't disagree. It's where men with defective equipment have pumps installed so that they can leave their wives for a yoga teacher. Okay, come back to me here. This is an invasion.<brk> She can see the show when it's ready.		She can see the show when <p>it</p>'s ready.	Elle peut voir le  spectacle  quand il sera prêt.	Elle peut voir le  <hon>spectacle<hoff>  quand <p>il</p> sera prêt.
Your sword... how strong is it?	Ton épée... elle est solide comment?	A hook. Hey. Come with me. This... Powder made from poppies. He has to inhale it.<brk> Your sword... how strong is it?		Your sword... how strong is <p>it</p>?	Ton  épée ... Est elle solide ?	Ton  <hon>épée<hoff> ... Est <p>elle</p> solide ?
That motherboard you found-- bomb squad confirmed it was part of the device, so touché.	La carte mère que vous avez trouvée... l'a confirmé qu'elle faisait partie du dispositif, donc touché.	Okay. This is a process. We can look for other candidates at group tonight. We are gonna find you a sponsor before my stint is up, okay? Ha. Captain.<brk> That motherboard you found-- bomb squad confirmed it was part of the device, so touché.		That motherboard you found-- bomb squad confirmed <p>it</p> was part of the device, so touché.	Cette  carte  mère que vous avez trouvée... les démineurs ont confirmé qu'elle faisait partie de l'engin, alors touché.	Cette  <hon>carte<hoff>  mère que vous avez trouvée... les démineurs ont confirmé qu'<p>elle</p> faisait partie de l'engin, alors touché.
Everest over here wants to keep things just how they were.	L' Everest veut que les choses restent comme elles étaient.	Bye. All right, boys, what do you say we change the game to spice things up a little bit, huh? Please, spice it up. The spice is just fine for me. I gotta be honest with you. Mt.<brk> Everest over here wants to keep things just how they were.		Everest over here wants to keep things just how <p>they</p> were.	Le Mont Everest ici veut garder les  choses  comme elles sont.	Le Mont Everest ici veut garder les  <hon>choses<hoff>  comme <p>elles</p> sont.
Regina told me how this bloody thing worked... that it returned all our belongings to this land, as well as us.	Regina m'a dit comment cette saloperie a marché... qu'elle a rendu tous nos biens à cette terre, aussi bien qu'à nous.	You are a perceptive prince, aren't you? Where are you going? Listen, mate, the Enchanted Forest is your home. Mine is the Jolly Roger. Hook, you don't even know if it's...<brk> Regina told me how this bloody thing worked... that it returned all our belongings to this land, as well as us.		Regina told me how this bloody thing worked... that <p>it</p> returned all our belongings to this land, as well as us.	Regina m'a dit comment cette maudite  chose  fonctionnait... qu'elle ramenait toutes nos affaires dans ce pays, tout comme nous.	Regina m'a dit comment cette maudite  <hon>chose<hoff>  fonctionnait... qu'<p>elle</p> ramenait toutes nos affaires dans ce pays, tout comme nous.
It is 2014, and women are allowed to have relations with whomever they want.	Nous sommes en 2014, et les femmes ont le droit d'avoir des relations avec qui elles veulent.	Well, maybe it is. But so what? I mean, haven't you ever watched HBO? No. Well... neither have I. But I get the gist.<brk> It is 2014, and women are allowed to have relations with whomever they want.		It is 2014, and women are allowed to have relations with whomever <p>they</p> want.	On est en 2014, et les  femmes  ont le droit de fréquenter qui elles veulent.	On est en 2014, et les  <hon>femmes<hoff>  ont le droit de fréquenter qui <p>elles</p> veulent.
It was worth it to kill those girls, to hold them in my hands while they died, felt their last breath.	a valait la peine de tuer ces filles, de les tenir dans mes mains pendant qu'elles mouraient, de sentir leur dernier souffle.	I'm not talking. I think you're looking at the death penalty. I'll never make it to the chair. I'm a correctional officer. I won't last a week in prison, but can I tell you a little secret?<brk> It was worth it to kill those girls, to hold them in my hands while they died, felt their last breath.		It was worth it to kill those girls, to hold them in my hands while <p>they</p> died, felt their last breath.	Ça valait le coup de tuer ces  filles , les tenir dans mes mains pendant qu'elles mourraient, sentir leur dernier souffle.	Ça valait le coup de tuer ces  <hon>filles<hoff> , les tenir dans mes mains pendant qu'<p>elles</p> mourraient, sentir leur dernier souffle.
Don't make things any worse than they already are!	Ne rends pas les choses pires qu'elles ne le sont!	Joseph! Put the knife down! He's getting what he deserves. Joseph, put down the knife. Put it down!<brk> Don't make things any worse than they already are!		Don't make things any worse than <p>they</p> already are!	Ne rendez pas les  choses  pire qu'elles ne le sont déjà !	Ne rendez pas les  <hon>choses<hoff>  pire qu'<p>elles</p> ne le sont déjà !
Even water knows to jump off a griddle when it's hot.	Même l' eau sait sauter d'une grille quand il fait chaud.	Finally, yes. - I'm so sorry about before. - It ain't your fault, Willa. Do you really think she burned herself on purpose? When the good Lord made us, Willa, he gave us reflexes for a reason.<brk> Even water knows to jump off a griddle when it's hot.		Even water knows to jump off a griddle when <p>it</p>'s hot.	Même l' eau  sait sauter d'une plaque de cuisson quand elle est chaude.	Même l' <hon>eau<hoff>  sait sauter d'une plaque de cuisson quand <p>elle</p> est chaude.
